{"run":256,"commit":"cfb93f6","metric":246,"metrics":{},"status":"keep","description":"feat: treat generic relative markdown paths as explicit local file inputs so embedded local docs surface earlier in prefix scans","timestamp":1773933963100,"segment":17,"confidence":4}
{"run":257,"commit":"fafe07a","metric":247,"metrics":{},"status":"keep","description":"feat: treat backticked local script filenames as explicit local file inputs so setup/documentation tables surface earlier in prefix scans","timestamp":1773934017914,"segment":17,"confidence":3}
{"run":258,"commit":"fafe07a","metric":247,"metrics":{},"status":"discard","description":"feat: treat backticked local markdown filenames as explicit local file inputs, but discard because realtime_prefix_findings stayed flat at 247","timestamp":1773934063805,"segment":17,"confidence":2}
{"type":"config","name":"Release automation hardening for scanner and web","metricName":"release_guard_signals","metricUnit":"","bestDirection":"higher"}
{"run":259,"commit":"d53af3e","metric":0,"metrics":{},"status":"keep","description":"Baseline release-preflight implementation added and immediately surfaced real release drift: lingering v0.3.0 GitHub Action tags in scanner/web docs caused current-release preflight failure. Keeping this checkpoint because the new guardrail is useful; next step is to fix legacy action examples and rerun the benchmark.","timestamp":1774230814149,"segment":18,"confidence":null,"asi":{"hypothesis":"A basic release preflight plus mutation benchmark will catch common scanner/web release drift before publishing.","surprising_finding":"Current repositories still contain legacy v0.3.0 action tag examples that release prep had not updated.","next_action_hint":"Normalize all scanner action examples to the current scanner version, then rerun the release-hardening benchmark."}}
{"run":260,"commit":"e920843","metric":8,"metrics":{},"status":"keep","description":"fix: normalize lingering v0.3.0 action examples in scanner README and vendored web README so the new release preflight passes on the real repos; baseline guard now catches 7/8 release-drift scenarios with current_release_pass=1.","timestamp":1774230861766,"segment":18,"confidence":null,"asi":{"hypothesis":"Once legacy action tag drift is removed, the new release-preflight benchmark should establish a meaningful baseline for release-hardening work.","bottleneck":"The only uncovered benchmark scenario is stale action source changing without rebuilding the bundle.","next_action_hint":"Add a source fingerprint to the action bundle and have preflight verify it so stale-bundle drift is caught automatically."}}
{"run":261,"commit":"dce4132","metric":9,"metrics":{},"status":"keep","description":"feat: add ACTION_SOURCE_HASH metadata to the GitHub Action bundle and verify it during release preflight; the release-hardening benchmark now catches all 8 modeled drift scenarios while the current scanner/web release state still passes.","timestamp":1774230960297,"segment":18,"confidence":null,"asi":{"hypothesis":"Embedding an action-source fingerprint in the bundled GitHub Action will catch stale-bundle drift that simple version checks miss.","learning":"A small build-time banner plus preflight comparison closes the last uncovered benchmark hole without adding dependencies.","next_action_hint":"Automate the repetitive release sync steps themselves so version bumps, changelog entries, and web vendoring can be prepared by script instead of manual edits."}}
{"run":262,"commit":"3b608a2","metric":10,"metrics":{},"status":"keep","description":"feat: add release:sync-web automation and benchmark it against a drifted temporary web checkout; release hardening now covers full preflight detection plus one validated automation path, pushing release_guard_signals to 10 with current_release_pass=1.","timestamp":1774231162853,"segment":18,"confidence":10,"asi":{"hypothesis":"Automating the scanner→web sync path will remove one of the highest-friction manual release steps and can be validated inside the benchmark.","learning":"The sync script can reliably refresh vendored scanner assets, action-tag docs, fallback versions, and changelog scanner-version notes in a temp web checkout.","next_action_hint":"Consider a broader release-prepare script that also scaffolds scanner/web changelog entries and version bumps together, but avoid over-automating human-authored release notes."}}
