{"run":11,"commit":"c09632b","metric":11,"metrics":{},"status":"keep","description":"feat: merge broader behavioral auth families after report shaping","timestamp":1773458042678,"segment":1}
{"run":14,"commit":"061496c","metric":6,"metrics":{},"status":"keep","description":"feat: fold cookie-backed credential persistence into cookie auth summaries","timestamp":1773458581354,"segment":1}
{"run":15,"commit":"bdb1705","metric":5,"metrics":{},"status":"keep","description":"feat: narrow auth-profile dedup matching to real auth and session terms","timestamp":1773458647202,"segment":1}
{"type":"config","name":"Reduce merged auth/profile title suffix clutter","metricName":"auth_merge_suffixes","metricUnit":"","bestDirection":"lower"}
{"run":1,"commit":"54d1f6a","metric":14,"metrics":{},"status":"keep","description":"chore: baseline merged-title suffix clutter after auth/profile dedup","timestamp":1773458830494,"segment":1}
{"run":2,"commit":"a88f61e","metric":5,"metrics":{},"status":"keep","description":"feat: normalize merged title suffixes to a single clean annotation","timestamp":1773458876419,"segment":1}
{"run":3,"commit":"fbce46a","metric":0,"metrics":{},"status":"keep","description":"feat: move auth-profile merge provenance out of titles and into descriptions","timestamp":1773459068399,"segment":1}
{"type":"config","name":"Reduce merged auth/profile description section clutter","metricName":"auth_merge_description_sections","metricUnit":"","bestDirection":"lower"}
{"run":1,"commit":"5949c8d","metric":24,"metrics":{},"status":"keep","description":"chore: baseline merged auth/profile description section clutter","timestamp":1773459311498,"segment":1}
{"run":2,"commit":"5949c8d","metric":0,"metrics":{},"status":"crash","description":"feat: collapse merged auth context descriptions into one unified section","timestamp":1773459426056,"segment":1}
{"run":3,"commit":"4ccd196","metric":5,"metrics":{},"status":"keep","description":"feat: collapse stacked merged auth description sections into one block","timestamp":1773459509640,"segment":1}
{"run":4,"commit":"f90537e","metric":0,"metrics":{},"status":"keep","description":"feat: rename merged auth description sections to cleaner related-context text","timestamp":1773459676873,"segment":1}
{"type":"config","name":"Reduce repeated rendered finding families in reports","metricName":"rendered_duplicate_findings","metricUnit":"","bestDirection":"lower"}
{"run":3,"commit":"84e7d41","metric":52,"metrics":{},"status":"keep","description":"feat: merge repeated browser content extraction findings in rendered reports","timestamp":1773463994282,"segment":1}
{"run":4,"commit":"913bea5","metric":44,"metrics":{},"status":"keep","description":"feat: merge repeated ui state enumeration findings in rendered reports","timestamp":1773464045207,"segment":1}
{"run":5,"commit":"21fc439","metric":44,"metrics":{},"status":"keep","description":"feat: merge repeated ui state enumeration findings in rendered reports","timestamp":1773464126813,"segment":1}
{"run":6,"commit":"83dee66","metric":35,"metrics":{},"status":"keep","description":"feat: merge repeated skill path and external override finding families","timestamp":1773464194516,"segment":1}
{"run":7,"commit":"c11e4a0","metric":30,"metrics":{},"status":"keep","description":"feat: merge repeated orchestration and remote-doc finding families","timestamp":1773464248890,"segment":1}
{"run":8,"commit":"88df2a5","metric":23,"metrics":{},"status":"keep","description":"feat: merge repeated reconnaissance and integration finding families","timestamp":1773464325150,"segment":1}
{"type":"config","name":"Reduce false positives on safe skill fixtures","metricName":"safe_fixture_medium_plus","metricUnit":"","bestDirection":"lower"}
{"run":1,"commit":"918501c","metric":22,"metrics":{"safe_fixture_score_min":83,"malicious_score_max":78,"safe_fixture_regressions":1,"test_pass":1},"status":"keep","description":"chore: baseline false positive benchmark — 22 safe_fixture_medium_plus","timestamp":1773718440693,"segment":6}
{"run":2,"commit":"dbd6ef0","metric":13,"metrics":{"safe_fixture_score_min":92,"malicious_score_max":78,"safe_fixture_regressions":0,"test_pass":1},"status":"keep","description":"feat: expand negation detection and security-education skill classification","timestamp":1773718565995,"segment":6}
{"run":3,"commit":"e0eba52","metric":11,"metrics":{"safe_fixture_score_min":92,"malicious_score_max":78,"safe_fixture_regressions":0,"test_pass":1},"status":"keep","description":"feat: skip capability inferences inside safety boundary sections and expand negation window","timestamp":1773718737306,"segment":6}
{"run":4,"commit":"83668a8","metric":10,"metrics":{"safe_fixture_score_min":92,"malicious_score_max":78,"safe_fixture_regressions":0,"test_pass":1},"status":"keep","description":"feat: suppress findings in safety sections with line-level negation and expand defense skill detection","timestamp":1773718937955,"segment":6}
{"run":5,"commit":"8e88a85","metric":7,"metrics":{"safe_fixture_score_min":92,"malicious_score_max":78,"safe_fixture_regressions":0,"test_pass":1},"status":"keep","description":"feat: fix defense skill detection for config-tampering and expand safety section headings","timestamp":1773719098156,"segment":6}
{"run":6,"commit":"589d310","metric":6,"metrics":{"safe_fixture_score_min":94,"malicious_score_max":78,"safe_fixture_regressions":0,"test_pass":1},"status":"keep","description":"feat: downgrade code-safety severity for known installer domains and suppress URL-based network inference for defense skills","timestamp":1773719183794,"segment":6}
{"run":7,"commit":"509946f","metric":5,"metrics":{"safe_fixture_score_min":94,"malicious_score_max":78,"safe_fixture_regressions":0,"test_pass":1},"status":"keep","description":"feat: fully suppress code-safety findings in example blocks for defense/educational skills","timestamp":1773719249817,"segment":6}
{"type":"config","name":"Widen score gap between safe and malicious skill fixtures","metricName":"score_gap","metricUnit":"","bestDirection":"higher"}
{"run":1,"commit":"53c26f8","metric":16,"metrics":{"safe_score_min":94,"malicious_score_max":78,"safe_score_avg":98,"malicious_score_avg":67,"test_pass":1},"status":"keep","description":"chore: baseline score separation — gap=16 (safe_min=94, malicious_max=78)","timestamp":1773719436737,"segment":6}
{"run":2,"commit":"d31e10f","metric":45,"metrics":{"safe_score_min":92,"malicious_score_max":47,"safe_score_avg":98,"malicious_score_avg":34,"test_pass":1},"status":"keep","description":"feat: add cross-category severity penalty for critical/high findings","timestamp":1773719471989,"segment":6}
{"run":3,"commit":"861d6e7","metric":48,"metrics":{"safe_score_min":91,"malicious_score_max":43,"safe_score_avg":98,"malicious_score_avg":31,"test_pass":1},"status":"keep","description":"feat: increase high-finding penalty from 2 to 3 per finding","timestamp":1773719536510,"segment":6}
{"run":4,"commit":"861d6e7","metric":48,"metrics":{"safe_score_min":89,"malicious_score_max":41,"safe_score_avg":95,"malicious_score_avg":28,"test_pass":0},"status":"discard","description":"revert: medium-finding penalty breaks legit-curl-install test (89 < 90)","timestamp":1773719568711,"segment":6}
{"run":5,"commit":"99b7130","metric":56,"metrics":{"safe_score_min":91,"malicious_score_max":35,"safe_score_avg":98,"malicious_score_avg":18,"test_pass":1},"status":"keep","description":"feat: add worst-category drag penalty when any category scores below 30","timestamp":1773719591835,"segment":6}
{"run":6,"commit":"4f7f4c7","metric":61,"metrics":{"safe_score_min":91,"malicious_score_max":30,"safe_score_avg":98,"malicious_score_avg":14,"test_pass":1},"status":"keep","description":"feat: widen worst-category drag threshold from 30 to 40","timestamp":1773719632043,"segment":6}
{"run":7,"commit":"6fbaae1","metric":66,"metrics":{"safe_score_min":91,"malicious_score_max":25,"safe_score_avg":98,"malicious_score_avg":10,"test_pass":1},"status":"keep","description":"feat: widen worst-category drag threshold to 50","timestamp":1773719659418,"segment":6}
{"run":8,"commit":"533eef6","metric":71,"metrics":{"safe_score_min":91,"malicious_score_max":20,"safe_score_avg":98,"malicious_score_avg":7,"test_pass":1},"status":"keep","description":"feat: widen worst-category drag threshold to 60","timestamp":1773719680288,"segment":6}
{"run":9,"commit":"533eef6","metric":71,"metrics":{"safe_score_min":91,"malicious_score_max":15,"safe_score_avg":98,"malicious_score_avg":5,"test_pass":1},"status":"discard","description":"revert: threshold=70 crushes too many malicious to 0, losing score granularity — revert to 60","timestamp":1773719706025,"segment":6}
{"run":10,"commit":"9ee76ef","metric":71,"metrics":{"safe_score_min":91,"malicious_score_max":20,"safe_score_avg":98,"malicious_score_avg":7,"test_pass":1},"status":"keep","description":"chore: confirm stable state — gap=71, all tests pass","timestamp":1773719741258,"segment":6}
{"type":"config","name":"Reduce evasion fixture max score — catch more evasion attacks","metricName":"evasion_score_max","metricUnit":"","bestDirection":"lower"}
{"run":1,"commit":"f1e9986","metric":92,"metrics":{"evasion_score_avg":45,"safe_score_min":91,"evasion_gap":-1,"test_pass":1},"status":"keep","description":"chore: baseline evasion detection — max=92 (indirect-exfiltration passes as certified!)","timestamp":1773719902290,"segment":6}
{"run":2,"commit":"7e7859b","metric":75,"metrics":{"evasion_score_avg":30,"safe_score_min":91,"evasion_gap":16,"test_pass":1},"status":"keep","description":"feat: detect URL-parameter exfiltration, comprehensive secret collection, and fake defense-skill abuse","timestamp":1773720130139,"segment":6}
{"run":3,"commit":"b91c8e6","metric":70,"metrics":{"evasion_score_avg":23,"safe_score_min":91,"evasion_gap":21,"test_pass":1},"status":"keep","description":"feat: make exfiltration patterns immune to threat-listing reduction and boost suspicious-URL severity","timestamp":1773720260439,"segment":6}
{"run":4,"commit":"f26b772","metric":63,"metrics":{"evasion_score_avg":22,"safe_score_min":91,"evasion_gap":28,"test_pass":1},"status":"keep","description":"feat: elevate curl|sh to suspicious domains/IPs to critical in code-safety analyzer","timestamp":1773720301868,"segment":6}
{"run":5,"commit":"7144390","metric":62,"metrics":{"evasion_score_avg":22,"safe_score_min":91,"evasion_gap":29,"test_pass":1},"status":"keep","description":"feat: elevate dependencies deduction for high-abuse TLDs (.xyz, .top, etc.)","timestamp":1773720413215,"segment":6}
{"run":6,"commit":"77d82ce","metric":40,"metrics":{"evasion_score_avg":19,"safe_score_min":91,"evasion_gap":51,"test_pass":1},"status":"keep","description":"feat: keep distinct critical curl|sh findings across blocks for different suspicious targets","timestamp":1773720513006,"segment":6}
{"run":7,"commit":"da61578","metric":29,"metrics":{"evasion_score_avg":13,"safe_score_min":91,"evasion_gap":62,"test_pass":1},"status":"keep","description":"feat: add suspicious download-and-execute injection pattern with code-block severity override","timestamp":1773720626106,"segment":6}
{"run":8,"commit":"1609081","metric":24,"metrics":{"evasion_score_avg":10,"safe_score_min":91,"evasion_gap":67,"test_pass":1},"status":"keep","description":"feat: expand concealment directive detection to catch flexible word order","timestamp":1773720791222,"segment":6}
{"run":9,"commit":"8f74ca0","metric":24,"metrics":{"evasion_score_avg":10,"safe_score_min":91,"evasion_gap":67,"test_pass":1},"status":"keep","description":"chore: confirm stable state — evasion_max=24, all 8 evasion fixtures rejected, gap=67","timestamp":1773720879887,"segment":6}
{"run":10,"commit":"8ac5cdb","metric":24,"metrics":{"evasion_score_avg":8,"safe_score_min":91,"evasion_gap":67,"test_pass":1},"status":"keep","description":"feat: catch concatenate-and-send-to-URL exfiltration pattern and suspicious domain sends","timestamp":1773720935211,"segment":6}
{"run":11,"commit":"e6ef527","metric":12,"metrics":{"evasion_score_avg":5,"safe_score_min":91,"evasion_gap":79,"test_pass":1},"status":"keep","description":"feat: add 'variables' to data exfiltration pattern + data exfil to NEVER_REDUCE set + widen word gap","timestamp":1773721048178,"segment":6}
{"run":12,"commit":"d8b092d","metric":12,"metrics":{"evasion_score_avg":5,"safe_score_min":91,"evasion_gap":79,"test_pass":1},"status":"keep","description":"chore: final stable state — evasion_max=12, avg=5, gap=79, all safe fixtures certified/conditional","timestamp":1773721119808,"segment":6}
{"run":13,"commit":"d8b092d","metric":14,"metrics":{"evasion_score_avg":7,"safe_score_min":93,"evasion_gap":79,"test_pass":1},"status":"discard","description":"revert: reduced contract-mismatch penalty helps safe scores (+2) but worsens evasion max (12→14)","timestamp":1773721288098,"segment":6}
{"run":14,"commit":"e63354c","metric":12,"metrics":{"evasion_score_avg":5,"safe_score_min":91,"evasion_gap":79,"test_pass":1},"status":"keep","description":"chore: fix reverted state — evasion_max=12, gap=79","timestamp":1773721348200,"segment":6}
{"run":15,"commit":"d51f56c","metric":12,"metrics":{"evasion_score_avg":4,"safe_score_min":91,"evasion_gap":79,"test_pass":1},"status":"keep","description":"feat: detect environment variable exfiltration and mass file POST patterns in behavioral analyzer","timestamp":1773721392020,"segment":6}
{"run":16,"commit":"a9efcf6","metric":8,"metrics":{"evasion_score_avg":3,"safe_score_min":91,"evasion_gap":83,"test_pass":1},"status":"keep","description":"feat: detect data encoding for URL exfiltration behavioral pattern","timestamp":1773721421215,"segment":6}
{"run":17,"commit":"797178d","metric":4,"metrics":{"evasion_score_avg":2,"safe_score_min":91,"evasion_gap":87,"test_pass":1},"status":"keep","description":"feat: detect encode+transmit-to-URL exfiltration pattern in behavioral analyzer","timestamp":1773721485248,"segment":6}
{"type":"config","name":"Calibrate public corpus scores — reduce over-rejection of legitimate skills","metricName":"public_over_rejected","metricUnit":"","bestDirection":"lower"}
{"run":1,"commit":"2232ffd","metric":10,"metrics":{"public_score_avg":6,"safe_score_min":91,"evasion_score_max":4,"test_pass":1},"status":"keep","description":"chore: baseline calibration — all 10 public skills rejected, 0 have criticals, avg score=6","timestamp":1773721628970,"segment":6}
{"run":2,"commit":"1798786","metric":9,"metrics":{"public_score_avg":24,"safe_score_min":93,"evasion_score_max":4,"test_pass":1},"status":"keep","description":"feat: reduce severity penalty and worst-category drag for skills without critical findings","timestamp":1773721690445,"segment":6}
{"run":3,"commit":"643a34d","metric":7,"metrics":{"public_score_avg":42,"safe_score_min":93,"evasion_score_max":9,"test_pass":1},"status":"keep","description":"feat: remove worst-category drag for skills without critical findings and separate threat vs capability high penalty","timestamp":1773721817625,"segment":6}
{"run":4,"commit":"888365a","metric":5,"metrics":{"public_score_avg":53,"safe_score_min":94,"evasion_score_max":12,"test_pass":1},"status":"keep","description":"feat: only penalize threat-category highs (injection/concealment), not capability highs","timestamp":1773721876737,"segment":6}
{"run":5,"commit":"e03d6b8","metric":0,"metrics":{"public_score_avg":62,"safe_score_min":94,"evasion_score_max":12,"test_pass":1},"status":"keep","description":"feat: apply category score floor of 30 for skills without critical findings — prevents capability-rich skills from bottoming out","timestamp":1773721933301,"segment":6}
{"run":6,"commit":"915a0df","metric":0,"metrics":{"public_score_avg":62,"safe_score_min":94,"evasion_score_max":12,"test_pass":1},"status":"keep","description":"chore: confirm stable state — 0 public skills over-rejected, avg=62, all evasions rejected, safe_min=94","timestamp":1773721995695,"segment":6}
{"type":"config","name":"Reduce rendered duplicate findings in public corpus reports","metricName":"rendered_duplicate_findings","metricUnit":"","bestDirection":"lower"}
{"run":1,"commit":"7c22bde","metric":23,"metrics":{"rendered_duplicate_groups":16,"prefix_rendered_duplicate_findings":22,"public_issue_findings":227,"safe_fixture_regressions":1,"test_pass":1},"status":"keep","description":"chore: baseline rendered dedup — 23 duplicate findings across 16 groups","timestamp":1773722106915,"segment":6}
{"run":2,"commit":"880c09d","metric":0,"metrics":{"rendered_duplicate_groups":0,"prefix_rendered_duplicate_findings":2,"public_issue_findings":204,"safe_fixture_regressions":1,"test_pass":1},"status":"keep","description":"feat: merge all remaining duplicate behavioral and dependency finding families in rendered reports","timestamp":1773722131242,"segment":6}
{"run":3,"commit":"911cb3b","metric":0,"metrics":{"rendered_duplicate_groups":0,"prefix_rendered_duplicate_findings":2,"public_issue_findings":204,"safe_fixture_regressions":1,"test_pass":1},"status":"keep","description":"chore: confirm stable — 0 rendered duplicates, all tests pass","timestamp":1773722188656,"segment":6}
{"run":4,"commit":"ffc57da","metric":0,"metrics":{"rendered_duplicate_groups":0,"prefix_rendered_duplicate_findings":2,"public_issue_findings":204,"safe_fixture_regressions":0,"test_pass":1},"status":"keep","description":"feat: skip exec inference from known-installer curl|sh in Prerequisites sections — legit-curl-install now certified (94→96)","timestamp":1773722470858,"segment":6}
{"run":5,"commit":"a18c56c","metric":0,"metrics":{"rendered_duplicate_groups":0,"prefix_rendered_duplicate_findings":2,"public_issue_findings":204,"safe_fixture_regressions":0,"test_pass":1},"status":"keep","description":"chore: all optimization targets at ceiling — 0 dedup, 0 regressions, 4 true-positive medium+ remaining","timestamp":1773722540750,"segment":6}
{"type":"config","name":"Reduce repeated rendered finding families in prefix scans","metricName":"prefix_rendered_duplicate_findings","metricUnit":"","bestDirection":"lower"}
{"run":167,"commit":"3b7569b","metric":2,"metrics":{},"status":"keep","description":"chore: baseline prefix rendered-duplicate benchmark — 2 remaining duplicates from repeated prompt-file ingestion in baoyu-image-gen","timestamp":1773925294640,"segment":12,"confidence":null}
{"run":168,"commit":"ed3599f","metric":0,"metrics":{},"status":"keep","description":"feat: merge repeated prompt-file-ingestion findings in prefix reports; prefix duplicates 2→0 while full-report duplicates stay at 0","timestamp":1773925327648,"segment":12,"confidence":null}
{"type":"config","name":"Improve realtime prefix coverage on public skill corpus","metricName":"realtime_prefix_findings","metricUnit":"","bestDirection":"higher"}
{"run":169,"commit":"70b40b5","metric":193,"metrics":{},"status":"keep","description":"chore: pivot harness to public prefix-coverage benchmark — baseline realtime_prefix_findings=193 with safe fixtures still at 0 regressions","timestamp":1773925574808,"segment":13,"confidence":null}
{"run":170,"commit":"70b40b5","metric":192,"metrics":{},"status":"discard","description":"feat: add description fallbacks for unrestricted/form/content inference plus state save/load file signals, but discard because realtime_prefix_findings regressed 193→192 with no public-coverage gain","timestamp":1773925703858,"segment":13,"confidence":null}
{"run":171,"commit":"a9737cf","metric":194,"metrics":{},"status":"keep","description":"feat: surface project-setup package bootstrap risk earlier from package.json/tsconfig project-structure guidance in prefix scans","timestamp":1773926101513,"segment":13,"confidence":1}
{"run":172,"commit":"a9737cf","metric":194,"metrics":{},"status":"discard","description":"feat: treat direct MCP endpoint guidance as local-service access, but discard because realtime_prefix_findings stayed flat at 194 while public_issue_findings regressed 204→203","timestamp":1773926177692,"segment":13,"confidence":2}
{"run":173,"commit":"a9737cf","metric":194,"metrics":{},"status":"discard","description":"feat: broaden comprehensive-secret collection to profile-copy bundles, but discard because realtime_prefix_findings stayed flat at 194 while public_issue_findings/public_high_findings regressed 204→203 and 44→43","timestamp":1773926233141,"segment":13,"confidence":null}
{"run":174,"commit":"0fca7c4","metric":195,"metrics":{},"status":"keep","description":"feat: infer markdown-article ingestion and HTML conversion earlier so article-posting workflows surface docs/file-write capability in prefix scans","timestamp":1773926338711,"segment":13,"confidence":4}
{"run":175,"commit":"c539e4a","metric":196,"metrics":{},"status":"keep","description":"fix: match markdown→html conversion correctly so article-posting workflows surface file-write capability earlier in prefix scans","timestamp":1773926400804,"segment":13,"confidence":3}
{"run":176,"commit":"7f2ca0b","metric":197,"metrics":{},"status":"keep","description":"feat: treat Express server scaffolding as early local-service access so clawdirect-dev exposes that risk before localhost examples appear","timestamp":1773926618245,"segment":13,"confidence":4}
{"run":177,"commit":"6fdcab9","metric":198,"metrics":{},"status":"keep","description":"feat: treat explicit webapp-testing guidance as early local-service access so browser automation skills surface localhost risk before concrete URLs appear","timestamp":1773926730223,"segment":13,"confidence":5}
{"type":"config","name":"Raise clearly risky public-corpus findings to high severity","metricName":"public_high_findings","metricUnit":"","bestDirection":"higher"}
{"run":178,"commit":"fa77438","metric":45,"metrics":{},"status":"keep","description":"chore: pivot to public high-severity benchmark — baseline public_high_findings=45 with realtime_prefix_findings holding at 198","timestamp":1773926878713,"segment":14,"confidence":null}
