{"run":179,"commit":"2f22f31","metric":46,"metrics":{},"status":"keep","description":"feat: elevate explicit anti-automation bypass guidance to a high-severity behavioral finding","timestamp":1773926925963,"segment":14,"confidence":null}
{"run":180,"commit":"f3a1482","metric":48,"metrics":{},"status":"keep","description":"feat: keep browser JavaScript eval at full severity inside executable code blocks so browser-use and agent-browser surface it as high risk","timestamp":1773927007817,"segment":14,"confidence":3}
{"run":181,"commit":"7a9a0e0","metric":51,"metrics":{},"status":"keep","description":"feat: keep explicit system-modification and secret-bearing CLI commands at full severity inside executable code blocks","timestamp":1773927039095,"segment":14,"confidence":4}
{"run":182,"commit":"fa66739","metric":55,"metrics":{},"status":"keep","description":"feat: keep package-bootstrap commands at full severity inside executable code blocks so npx/npm bootstrap snippets stay high-risk","timestamp":1773927066850,"segment":14,"confidence":3.3333333333333335}
{"run":183,"commit":"3fa114e","metric":59,"metrics":{},"status":"keep","description":"feat: keep localhost/service-access commands at full severity inside executable code blocks so concrete internal endpoints count as high-risk","timestamp":1773927099362,"segment":14,"confidence":3.5}
{"run":184,"commit":"9644c3d","metric":60,"metrics":{},"status":"keep","description":"feat: elevate explicit run-without-asking guidance to a high-severity behavioral finding","timestamp":1773927170327,"segment":14,"confidence":3}
{"run":185,"commit":"a220bcb","metric":62,"metrics":{},"status":"keep","description":"feat: elevate agent-callable external tool bridges to high severity for MCP-style capability expansion","timestamp":1773927231931,"segment":14,"confidence":2.6153846153846154}
{"run":186,"commit":"a70b677","metric":63,"metrics":{},"status":"keep","description":"feat: elevate payment-processing and charge-for-action guidance to high severity","timestamp":1773927304802,"segment":14,"confidence":2.5714285714285716}
{"run":187,"commit":"010c5ef","metric":64,"metrics":{},"status":"keep","description":"feat: elevate black-box helper-script execution guidance to high severity","timestamp":1773927345529,"segment":14,"confidence":3.1666666666666665}
{"run":188,"commit":"330cb87","metric":65,"metrics":{},"status":"keep","description":"feat: elevate remote documentation/WebFetch ingestion to high severity because fetched docs can relay untrusted instructions","timestamp":1773927377004,"segment":14,"confidence":4}
{"run":189,"commit":"f1793d5","metric":66,"metrics":{},"status":"keep","description":"feat: elevate third-party AI-provider delegation to high severity because prompts/images are forwarded off-box","timestamp":1773927420623,"segment":14,"confidence":4.2}
{"run":190,"commit":"f1793d5","metric":0,"metrics":{},"status":"checks_failed","description":"feat: raise localhost/private-network URL references to high severity, but tests failed so revert the change","timestamp":1773927508897,"segment":14,"confidence":4.2}
{"run":191,"commit":"654c21c","metric":69,"metrics":{},"status":"keep","description":"feat: classify explicit localhost/private-network URLs as high-risk dependency references and update tests accordingly","timestamp":1773927589833,"segment":14,"confidence":4.8}
{"run":192,"commit":"3176d59","metric":72,"metrics":{},"status":"keep","description":"feat: classify package-managed project bootstrap dependencies as high-risk supply-chain exposure","timestamp":1773927629518,"segment":14,"confidence":4.909090909090909}
{"run":193,"commit":"fbc6df7","metric":75,"metrics":{},"status":"keep","description":"feat: classify hosted-browser, third-party AI, and explicit external-service dependencies as high-risk off-box trust boundaries","timestamp":1773927683497,"segment":14,"confidence":4.285714285714286}
{"run":194,"commit":"9ef329a","metric":79,"metrics":{},"status":"keep","description":"feat: classify image/video/media artifact handoff dependencies as high-risk data-transfer boundaries","timestamp":1773927725497,"segment":14,"confidence":4.857142857142857}
{"run":195,"commit":"4d2b97c","metric":82,"metrics":{},"status":"keep","description":"feat: elevate prompt-file and local-file ingestion to high severity and keep remote-task snippets at full severity inside code blocks","timestamp":1773927895957,"segment":14,"confidence":4.625}
{"run":196,"commit":"eb0b392","metric":85,"metrics":{},"status":"keep","description":"feat: keep local file browsing and payment-action snippets at full severity inside executable code blocks","timestamp":1773927950346,"segment":14,"confidence":4.705882352941177}
{"run":197,"commit":"50ff727","metric":87,"metrics":{},"status":"keep","description":"feat: elevate automatic dev-server discovery and remote transport mechanisms to high severity","timestamp":1773928001801,"segment":14,"confidence":4.666666666666667}
{"run":198,"commit":"f268a86","metric":88,"metrics":{},"status":"keep","description":"feat: classify direct agent-callable endpoint references as high-risk dependency exposure","timestamp":1773928132285,"segment":14,"confidence":4.3}
{"run":199,"commit":"93232d3","metric":95,"metrics":{},"status":"keep","description":"feat: raise undeclared package-bootstrap capability mismatches to high severity to match their supply-chain risk","timestamp":1773928263020,"segment":14,"confidence":5}
{"run":200,"commit":"2805ccf","metric":101,"metrics":{},"status":"keep","description":"feat: raise undeclared local-service-access capability mismatches to high severity for localhost and internal endpoint workflows","timestamp":1773928302097,"segment":14,"confidence":4.666666666666667}
{"run":201,"commit":"1b8a3b4","metric":105,"metrics":{},"status":"keep","description":"feat: elevate undeclared remote-documentation ingestion to high severity when evidence shows external fetch/readme/spec workflows","timestamp":1773928425863,"segment":14,"confidence":4.615384615384615}
{"run":202,"commit":"dae2a0a","metric":107,"metrics":{},"status":"keep","description":"feat: raise undeclared external-tool-bridge capability mismatches to high severity for agent-callable integration workflows","timestamp":1773928458764,"segment":14,"confidence":4.592592592592593}
{"run":203,"commit":"a41718b","metric":110,"metrics":{},"status":"keep","description":"feat: raise undeclared remote-delegation capability mismatches to high severity for cloud-hosted and off-box execution workflows","timestamp":1773928501552,"segment":14,"confidence":4.642857142857143}
{"run":204,"commit":"f4ddd52","metric":115,"metrics":{},"status":"keep","description":"feat: raise undeclared server-exposure capability mismatches to high severity for MCP and service-hosting workflows","timestamp":1773928541413,"segment":14,"confidence":4.666666666666667}
{"run":205,"commit":"ebfa0f9","metric":119,"metrics":{},"status":"keep","description":"feat: raise undeclared content-extraction capability mismatches to high severity for browser scraping and page-capture workflows","timestamp":1773928570657,"segment":14,"confidence":4.933333333333334}
{"run":206,"commit":"ebfa0f9","metric":129,"metrics":{},"status":"discard","description":"feat: raise undeclared network-access capability mismatches to high severity, but discard because legit-curl-install regressed to 1 safe high finding / conditional","timestamp":1773928682992,"segment":14,"confidence":5.103448275862069}
{"run":207,"commit":"8fbd1d1","metric":141,"metrics":{},"status":"keep","description":"feat: raise undeclared browser-automation, local-input-control, process-orchestration, and credential-form capabilities to high severity","timestamp":1773928752851,"segment":14,"confidence":6}
{"run":208,"commit":"09b2d84","metric":149,"metrics":{},"status":"keep","description":"feat: raise undeclared UI-state, payment-processing, remote-task, prompt-file, and automation-evasion capabilities to high severity","timestamp":1773928829324,"segment":14,"confidence":5.777777777777778}
{"run":209,"commit":"90a0f5c","metric":159,"metrics":{},"status":"keep","description":"feat: raise undeclared network capability to high severity except for known installer domains so public networked skills tighten without regressing legit-curl-install","timestamp":1773928902864,"segment":14,"confidence":5.7}
{"run":210,"commit":"c6b5df4","metric":164,"metrics":{},"status":"keep","description":"feat: raise undeclared file-read capability mismatches to high severity for reference-file and local-content access workflows","timestamp":1773928967283,"segment":14,"confidence":5.666666666666667}
{"run":211,"commit":"0b667de","metric":169,"metrics":{},"status":"keep","description":"feat: elevate undeclared file-write capability only for state saves, script generation, config creation, and markdown-to-html conversion","timestamp":1773929054027,"segment":14,"confidence":5.391304347826087}
{"run":212,"commit":"30532a6","metric":177,"metrics":{},"status":"keep","description":"feat: elevate missing safety boundaries on high-risk workflows to a high-severity content finding","timestamp":1773929219689,"segment":14,"confidence":5.617021276595745}
{"run":213,"commit":"cbe7e5f","metric":181,"metrics":{},"status":"keep","description":"feat: elevate broad activation triggers to high severity when they advertise high-risk capabilities or privileged workflows","timestamp":1773929277522,"segment":14,"confidence":5.44}
{"run":214,"commit":"20e8068","metric":183,"metrics":{},"status":"keep","description":"feat: elevate broad path-probing and project-structure discovery capability mismatches to high severity","timestamp":1773929359450,"segment":14,"confidence":5.52}
{"run":215,"commit":"602688b","metric":185,"metrics":{},"status":"keep","description":"feat: raise undeclared configuration-override capability mismatches to high severity for sidecar override files like EXTEND.md","timestamp":1773929422191,"segment":14,"confidence":5.185185185185185}
{"run":216,"commit":"40c09cf","metric":188,"metrics":{},"status":"keep","description":"feat: classify remote documentation/spec dependencies as high-risk trust boundaries","timestamp":1773929484607,"segment":14,"confidence":5.2}
{"run":217,"commit":"0cbbccf","metric":190,"metrics":{},"status":"keep","description":"feat: classify exposed ports and healthcheck-based local service hints as high-risk dependency exposure","timestamp":1773929540991,"segment":14,"confidence":5.178571428571429}
{"run":218,"commit":"d6bfdc5","metric":191,"metrics":{},"status":"keep","description":"feat: classify local stdio/server-transport hints as high-risk local-service dependency exposure","timestamp":1773929576123,"segment":14,"confidence":4.786885245901639}
{"run":219,"commit":"1f70f0b","metric":194,"metrics":{},"status":"keep","description":"feat: elevate env/config capability mismatches when evidence references encryption keys or user-home config indirection","timestamp":1773929753052,"segment":14,"confidence":4.382352941176471}
{"run":220,"commit":"145f166","metric":198,"metrics":{},"status":"keep","description":"feat: elevate documentation-ingestion capability mismatches for local reference bundles and markdown article inputs","timestamp":1773929798853,"segment":14,"confidence":4.135135135135135}
{"run":221,"commit":"76917dc","metric":200,"metrics":{},"status":"keep","description":"feat: elevate undeclared file-write capability for screenshot/page-capture outputs that persist extracted content to disk","timestamp":1773929846301,"segment":14,"confidence":3.875}
{"run":222,"commit":"13f09ce","metric":201,"metrics":{},"status":"keep","description":"feat: elevate host/container reconnaissance commands to high severity for local environment enumeration workflows","timestamp":1773929889575,"segment":14,"confidence":3.7142857142857144}
{"run":223,"commit":"d67d4fa","metric":203,"metrics":{},"status":"keep","description":"feat: treat {baseDir}-style skill path resolution as high-severity filesystem discovery in capability contracts","timestamp":1773929974752,"segment":14,"confidence":3.590909090909091}
{"run":224,"commit":"92fce6e","metric":204,"metrics":{},"status":"keep","description":"feat: classify raw-content URL references as high-risk dependency exposure because mutable raw-hosted content bypasses stronger trust controls","timestamp":1773930047841,"segment":14,"confidence":3.533333333333333}
{"run":225,"commit":"29a93bf","metric":205,"metrics":{},"status":"keep","description":"feat: elevate many-URL dependency sprawl to high severity when sensitive workflows also mix raw or unknown remote sources","timestamp":1773930126645,"segment":14,"confidence":3.404255319148936}
{"run":226,"commit":"60d0c28","metric":206,"metrics":{},"status":"keep","description":"feat: elevate unknown external references to high severity when they point at remote docs/spec indexes","timestamp":1773930208151,"segment":14,"confidence":3.2857142857142856}
{"run":227,"commit":"7aafeb9","metric":207,"metrics":{},"status":"keep","description":"feat: elevate undeclared file-write capability for explicit image-output paths so generated media persistence is treated as a real high-risk write capability","timestamp":1773930277269,"segment":14,"confidence":3.24}
{"type":"config","name":"Improve realtime prefix coverage on public skill corpus","metricName":"realtime_prefix_findings","metricUnit":"","bestDirection":"higher"}
{"run":228,"commit":"7f19ad6","metric":198,"metrics":{},"status":"keep","description":"chore: pivot back to realtime prefix coverage after saturating public high-severity findings at 207/207","timestamp":1773930361817,"segment":15,"confidence":null}
{"run":229,"commit":"4e46006","metric":201,"metrics":{},"status":"keep","description":"feat: treat auth-state files and local reference bundles as high-risk local file access so prefix scans catch them earlier","timestamp":1773930485019,"segment":15,"confidence":null}
{"run":230,"commit":"ddd7152","metric":203,"metrics":{},"status":"keep","description":"feat: treat auth-state files and sidecar override docs like auth.json and EXTEND.md as explicit local file access so prefix scans catch them earlier","timestamp":1773930630574,"segment":15,"confidence":2.5}
{"run":231,"commit":"a14ddbf","metric":205,"metrics":{},"status":"keep","description":"feat: treat explicit 'suggest installing bun' guidance as high-severity system modification so setup-heavy skills surface earlier in prefix scans","timestamp":1773930844705,"segment":15,"confidence":3.5}
{"run":232,"commit":"01b3904","metric":210,"metrics":{},"status":"keep","description":"feat: treat explicit local script-path and scripts/*.ts references as high-risk local file access so setup-heavy skills surface earlier in prefix scans","timestamp":1773930920074,"segment":15,"confidence":6}
{"run":233,"commit":"01b3904","metric":210,"metrics":{},"status":"discard","description":"feat: broaden comprehensive-secret collection to copied Chrome profiles, but discard because realtime_prefix_findings stayed flat at 210 while public_issue_findings/public_high_findings regressed 221→220","timestamp":1773931020538,"segment":15,"confidence":2.6666666666666665}
{"run":234,"commit":"b72a2c9","metric":213,"metrics":{},"status":"keep","description":"feat: treat long-form markdown and saved prompt bundles as explicit local file inputs so prefix scans surface them earlier","timestamp":1773931110775,"segment":15,"confidence":3}
{"run":235,"commit":"a18eab6","metric":216,"metrics":{},"status":"keep","description":"feat: treat reference images, videos, and media-file flags as explicit local file inputs so media-heavy skills surface earlier in prefix scans","timestamp":1773931179437,"segment":15,"confidence":3.6}
{"run":236,"commit":"a18eab6","metric":216,"metrics":{},"status":"discard","description":"feat: broaden high-severity file-write escalation to screenshot paths and project-structure creation, but discard because realtime_prefix_findings stayed flat at 216","timestamp":1773931461444,"segment":15,"confidence":3}
{"run":237,"commit":"722f453","metric":219,"metrics":{},"status":"keep","description":"feat: keep local-file-access findings out of auth/profile dedup so report output preserves distinct file-input risks in prefix scans","timestamp":1773931619802,"segment":15,"confidence":3.5}
{"run":238,"commit":"3f4ca3c","metric":222,"metrics":{},"status":"keep","description":"feat: preserve distinct browser session/profile capability-contract findings instead of merging them into generic auth dedup summaries","timestamp":1773931798760,"segment":15,"confidence":4}
{"run":239,"commit":"a18eab6","metric":0,"metrics":{},"status":"checks_failed","description":"feat: preserve distinct behavioral auth families like browser profile copy and auth-state handling, but tests failed so revert the change","timestamp":1773932004136,"segment":15,"confidence":4}
{"run":240,"commit":"b42bf14","metric":226,"metrics":{},"status":"keep","description":"feat: treat local markdown reference links and plaintext auth-state file guidance as distinct local file-access risks in prefix scans","timestamp":1773932062634,"segment":15,"confidence":4}
{"run":241,"commit":"ee81bf3","metric":231,"metrics":{},"status":"keep","description":"feat: split auth-state save/load patterns and media text+image/video inputs so prefix scans catch more explicit local file inputs earlier","timestamp":1773932360053,"segment":15,"confidence":4.125}
{"run":242,"commit":"cca1624","metric":233,"metrics":{},"status":"keep","description":"feat: treat explicit browser profile paths and CLI profile directories as local file access so session-backed browser workflows surface earlier","timestamp":1773932554554,"segment":15,"confidence":4.117647058823529}
{"run":243,"commit":"d356158","metric":235,"metrics":{},"status":"keep","description":"feat: treat persistent CLI profiles and named session stores as explicit local file access so session-backed browser workflows surface earlier","timestamp":1773932727573,"segment":15,"confidence":3.7}
{"run":244,"commit":"b461c05","metric":236,"metrics":{},"status":"keep","description":"feat: treat explicit named browser profiles as local file access so copied user-profile workflows surface earlier","timestamp":1773932786989,"segment":15,"confidence":3.619047619047619}
{"run":245,"commit":"b461c05","metric":236,"metrics":{},"status":"discard","description":"feat: add explicit 'pay for services' financial-action pattern, but discard because realtime_prefix_findings stayed flat at 236","timestamp":1773932852764,"segment":15,"confidence":3.4545454545454546}
{"run":246,"commit":"075e8fd","metric":237,"metrics":{},"status":"keep","description":"feat: add an implied local-service endpoint dependency when EXPOSE and HEALTHCHECK appear together in setup/docker workflows","timestamp":1773932897305,"segment":15,"confidence":3}
{"run":247,"commit":"075e8fd","metric":237,"metrics":{},"status":"discard","description":"chore: revalidate current realtime-prefix state before resuming search; metric holds at 237 with safe guardrails intact","timestamp":1773933064961,"segment":15,"confidence":2.7857142857142856}
{"run":248,"commit":"a18eab6","metric":278,"metrics":{},"status":"discard","description":"feat: allow multi-evidence local-file-access findings, but discard because it explodes report noise and likely overcounts setup/reference lines (public_issue_findings 249→327)","timestamp":1773933315454,"segment":15,"confidence":2.888888888888889}
{"run":249,"commit":"075e8fd","metric":237,"metrics":{},"status":"discard","description":"feat: treat copied Chrome profiles as comprehensive secret collection, but discard because realtime_prefix_findings stayed flat and public totals regressed slightly","timestamp":1773933396779,"segment":15,"confidence":3}
{"run":250,"commit":"1f0a41a","metric":244,"metrics":{},"status":"keep","description":"feat: treat gitignore, user-home config paths, and XDG/home dot-config indirection as explicit local file access so profile/config-backed workflows surface earlier","timestamp":1773933482712,"segment":15,"confidence":3.68}
{"type":"config","name":"Raise remaining medium public-corpus findings to high severity","metricName":"public_high_findings","metricUnit":"","bestDirection":"higher"}
{"run":251,"commit":"14679b8","metric":254,"metrics":{},"status":"keep","description":"chore: pivot to remaining medium-finding severity calibration — baseline public_high_findings=254 with prefix coverage at 244","timestamp":1773933573710,"segment":16,"confidence":null}
{"run":252,"commit":"57d007e","metric":256,"metrics":{},"status":"keep","description":"feat: raise undeclared session-management capability mismatches to high severity for background daemons and saved-session workflows","timestamp":1773933611810,"segment":16,"confidence":null}
{"type":"config","name":"Improve realtime prefix coverage on public skill corpus","metricName":"realtime_prefix_findings","metricUnit":"","bestDirection":"higher"}
{"run":253,"commit":"907e7d1","metric":244,"metrics":{},"status":"keep","description":"chore: pivot back to realtime prefix coverage after saturating public high-severity findings at 256/256","timestamp":1773933686238,"segment":17,"confidence":null}
{"run":254,"commit":"907e7d1","metric":244,"metrics":{},"status":"discard","description":"feat: treat copied Chrome profiles as comprehensive secret collection, but discard because realtime_prefix_findings stayed flat and public totals regressed slightly","timestamp":1773933829496,"segment":17,"confidence":null}
{"run":255,"commit":"ac03993","metric":245,"metrics":{},"status":"keep","description":"feat: treat plain ./reference/*.md paths as explicit local file inputs so reference-heavy skills surface earlier in prefix scans","timestamp":1773933891493,"segment":17,"confidence":null}
